{
  "id": "lb:obj:identity-v2-claim",
  "schemaVersion": "0.1.0",
  "type": "inquiry",
  "createdAt": "2026-07-11T00:00:00Z",
  "body": {
    "text": "How should this knowledge be verified?",
    "language": "en"
  },
  "contexts": {
    "topic": "test"
  },
  "labels": ["identity-v2"],
  "provenance": {
    "sources": [
      {
        "protocol": "example",
        "sourceId": "source-a"
      }
    ]
  },
  "rawRef": {
    "protocol": "example",
    "sourceId": "raw-a"
  },
  "identityClaims": [
    {
      "schemaVersion": "1",
      "claimType": "identity",
      "ruleVersion": "lb.identity.key.v2",
      "identityKey": "lb:key:lb.identity.key.v2:sha256:4c04d7c2c91bcc08c7757937e5d0ba6b41657aaaf81f923ab8ded2f6b1404962",
      "canonicalId": "lb:obj:identity-v2-claim",
      "issuer": {
        "protocol": "example",
        "sourceId": "validator-test"
      },
      "issuedAt": "2026-07-11T00:00:00Z",
      "verification": {
        "method": "fixture",
        "payloadHash": "sha256:0000000000000000000000000000000000000000000000000000000000000000",
        "status": "verified"
      }
    }
  ]
}
