{
  "id": "lb:obj:example-0001",
  "schemaVersion": "0.1.0",
  "type": "inquiry",
  "createdAt": "2026-06-17T00:00:00Z",
  "body": {
    "text": "What evidence supports this claim?",
    "language": "en"
  },
  "provenance": {
    "sources": [
      {
        "protocol": "lingonberry",
        "sourceId": "draft:example-0001",
        "authorId": "alice",
        "observedAt": "2026-06-17T00:00:00Z"
      }
    ]
  },
  "rawRef": {
    "protocol": "lingonberry",
    "sourceId": "draft:example-0001",
    "locator": "memory://drafts/example-0001",
    "payloadHash": "sha256:0000000000000000000000000000000000000000000000000000000000000000"
  },
  "identityClaims": [
    {
      "schemaVersion": "1",
      "claimType": "identity",
      "ruleVersion": "lb.identity.key.v1",
      "identityKey": "lb:key:lb.identity.key.v1:fnv1a64:ad53203bfcfed201",
      "canonicalId": "lb:obj:example-0001",
      "issuer": {
        "protocol": "lingonberry",
        "sourceId": "relay:example",
        "signerId": "307270eca005df54e3ca169c6139ffc228c4f0069c24ce1260fbf3394f51b9ac"
      },
      "issuedAt": "2026-06-17T00:00:00Z",
      "verification": {
        "method": "ed25519-signature",
        "payloadHash": "sha256:2222222222222222222222222222222222222222222222222222222222222222",
        "signature": "sig:example-identity-claim-0001",
        "status": "verified"
      }
    }
  ]
}
